Page,Meta description
https://wertymsd.github.io/sage50bi/,"Crea consultas personalizadas en SAGE50 con plantillas SQL y simplifica los cuadro de mando y informes, Realiza informes  avanzados de manera eficiente y sencilla."
https://wertymsd.github.io/sage50bi/conexion-con-sage50/,"Aprende a conectar SAGE50 BI a tu base de datos SQL paso a paso. Configura servidor, usuario y selecciona la base de datos fácilmente."
https://wertymsd.github.io/sage50bi/configuracion-api-google/,Configura la API de Google en SAGE50 BI con tu cuenta Gmail y gestiona informes y cuadros de mando de forma segura y eficiente.
https://wertymsd.github.io/sage50bi/configuracion-secccion-email/,Configura el envío de correos en SAGE50 BI usando la versión de escritorio de Outlook para facilitar la automatización de informes o con el estandar SMTP.
https://wertymsd.github.io/sage50bi/configuracion-secccion-envio/,"Genera documentos personalizados filtrando datos en SAGE50 para cada cliente, vendedor o proveedor de manera eficiente con condiciones personalizadas."
https://wertymsd.github.io/sage50bi/configuracion-secccion-exporta/,Formato del fichero resultado de la exportacion de la consulta SQL
https://wertymsd.github.io/sage50bi/configuracion-secccion-ftp/,Genera documentos personalizados filtrando datos en SAGE50 para cada cliente de manera eficiente con condiciones personalizadas.
https://wertymsd.github.io/sage50bi/configuracion-secccion-informe/,Configura informes en SAGE50 BI utilizando el generador de informes de Microsoft Power BI. Optimiza la presentación de datos.
https://wertymsd.github.io/sage50bi/configuracion-secccion-sql/,Realiza consultas avanzadas en la base de datos del Grupo de empresas en SAGE50. Automatiza la extracción y análisis de datos.
https://wertymsd.github.io/sage50bi/generador-informes-microsoft-power-bi/,Crea informes profesionales y perfectamente adaptados para impresión o distribución electrónica con Microsoft Power BI en SAGE50.
https://wertymsd.github.io/sage50bi/guia-archivos-plantillas-informes/,Estructura consulta en SAGE50 BI con plantillas bien organizadas. Mejora la gestión y comprensión de los informes.
https://wertymsd.github.io/sage50bi/link-descarga/,Descarga gratuita del programa para crear informes personalizados y cuadros de mando en SAGE50. Mejora tu análisis de datos.
https://wertymsd.github.io/sage50bi/looker-studio/,Crea informes personalizados y paneles interactivos con Looker Studio conectando datos de diversas fuentes. Ideal para SAGE50.
https://wertymsd.github.io/sage50bi/parametros-ejecucion-sage50bi/,Define los parámetros de ejecución en SAGE50 BI para automatizar procesos. Personaliza tus informes y consultas fácilmente.
https://wertymsd.github.io/sage50bi/ejemplos/ejemplos-plantillas-articulos/,Plantillas de ejemplos para consultas de artículos en SAGE50. Optimiza el análisis de inventarios y catálogos de productos.
https://wertymsd.github.io/sage50bi/ejemplos/ejemplos-plantillas-clientes/,Plantillas de ejemplos para consultas de clientes en SAGE50. Mejora la gestión y análisis de tu base de datos de clientes.
https://wertymsd.github.io/sage50bi/ejemplos/ejemplos-plantillas-contabilidad/,Plantillas de ejemplos para consultas de contabilidad en SAGE50. Facilita el análisis financiero y la generación de informes contables.
https://wertymsd.github.io/sage50bi/ejemplos/ejemplos-plantillas-previsiones/,Plantillas de ejemplos para consultas de previsiones en SAGE50. Mejora la planificación y predicciones de ventas y stock.
https://wertymsd.github.io/sage50bi/ejemplos/ejemplos-plantillas-proveedores/,Plantillas de ejemplos para consultas de proveedores en SAGE50. Mejora la gestión y análisis de tus relaciones comerciales.
